{"schema_version":"0.1","id":"neurodiversity","type":"concept","name":"Neurodiversity","aliases":["neurological diversity"],"status":"seed","summary":"Neurodiversity describes variation in human minds and nervous systems across a population and is also used in social and political frameworks about how neurological difference, disability, rights, environment and support should be understood.","scope":{"includes":["Variation in neurological and cognitive characteristics across all people.","The history, movement and paradigm uses of neurodiversity.","Relationships among disability, environment, rights, identity, access and support."],"excludes":["A diagnosis or a synonym for neurodivergent.","A fixed or universally agreed list of neurodivergent groups.","A claim that every neurological difference is beneficial or that support and clinical care are unnecessary.","Using neurodiversity as a diagnostic or taxonomic superclass for conditions such as autism or ADHD."]},"claims":[{"id":"neurodiversity-claim-origins","text":"Neurodiversity theory developed through collective autistic and neurodivergent community activity as well as named writers; Judy Singer was an important early contributor, but a single-originator account is not supported by the historical record.","confidence":"high","source_ids":["neurodiversity-source-botha-2024","neurodiversity-source-singer-2016"],"uncertainty_ids":["neurodiversity-uncertainty-origins"]},{"id":"neurodiversity-claim-paradigm","text":"Neurodiversity as a descriptive fact about human variation is distinct from the neurodiversity paradigm or movement, which adds social, ethical and political commitments about how that variation should be understood and accommodated.","confidence":"moderate","source_ids":["neurodiversity-source-pellicano-2022","neurodiversity-source-kapp-2026"],"uncertainty_ids":["neurodiversity-uncertainty-boundaries","neurodiversity-uncertainty-operational"]},{"id":"neurodiversity-claim-disability","text":"A neurodiversity framing does not require denying disability, substantial support needs or clinical care; disagreement remains about how medical and social explanations should be balanced in particular contexts.","confidence":"moderate","source_ids":["neurodiversity-source-pellicano-2022","neurodiversity-source-kapp-2026"],"uncertainty_ids":["neurodiversity-uncertainty-representation","neurodiversity-uncertainty-operational"]}],"sources":[{"id":"neurodiversity-source-botha-2024","kind":"peer_reviewed","citation":"Botha M et al. The neurodiversity concept was developed collectively: An overdue correction on the origins of neurodiversity theory. Autism. 2024;28(6):1591-1594.","url":"https://researchportal.port.ac.uk/en/publications/the-neurodiversity-concept-was-developed-collectively-an-overdue-/","doi":"10.1177/13623613241237871","accessed":"2026-08-12","supports":["neurodiversity-claim-origins","neurodiversity-perspective-collective"]},{"id":"neurodiversity-source-singer-2016","kind":"historical","citation":"Singer J. NeuroDiversity: The Birth of an Idea. Kindle edition. 2016; based on the 1998 thesis Odd People In.","url":"https://wellcomecollection.org/works/ywrdd8ff","accessed":"2026-08-12","supports":["neurodiversity-claim-origins"]},{"id":"neurodiversity-source-pellicano-2022","kind":"peer_reviewed","citation":"Pellicano E, den Houting J. Annual Research Review: Shifting from 'normal science' to neurodiversity in autism science. Journal of Child Psychology and Psychiatry. 2022;63(4):381-396.","url":"https://pubmed.ncbi.nlm.nih.gov/34730840/","doi":"10.1111/jcpp.13534","accessed":"2026-08-12","supports":["neurodiversity-claim-paradigm","neurodiversity-claim-disability","neurodiversity-perspective-paradigm"]},{"id":"neurodiversity-source-kapp-2026","kind":"peer_reviewed","citation":"Kapp SK. The neurodiversity movement vs. the medical model of autism. World Psychiatry. 2026;25(2):322-323.","url":"https://pubmed.ncbi.nlm.nih.gov/42136518/","doi":"10.1002/wps.70076","accessed":"2026-08-12","supports":["neurodiversity-claim-paradigm","neurodiversity-claim-disability","neurodiversity-perspective-integration"]}],"uncertainties":[{"id":"neurodiversity-uncertainty-origins","question":"How should credit be distributed among autistic online communities, activists, Judy Singer, Harvey Blume and other early participants?","why_it_matters":"Origin stories allocate authority and can erase collective community work.","what_would_reduce_it":["Dated primary archives interpreted with participant context and consent, and converging accounts from multiple early participants."],"status":"open"},{"id":"neurodiversity-uncertainty-boundaries","question":"Which uses of neurodivergent are useful in clinical, legal, community and political contexts?","why_it_matters":"A single universal boundary can exclude people or make the term too imprecise for the task.","what_would_reduce_it":["Purpose-specific definitions and community-led comparative work documenting benefits and harms of different inclusion rules."],"status":"open"},{"id":"neurodiversity-uncertainty-operational","question":"Which claims made under the neurodiversity paradigm are empirical claims that can be tested, and which are ethical or political commitments?","why_it_matters":"Mixing descriptive evidence with values can make a preferred framework appear empirically proven by definition.","what_would_reduce_it":["Studies and scholarship that state normative assumptions separately from measurable claims and compare outcomes across competing approaches."],"status":"open"},{"id":"neurodiversity-uncertainty-representation","question":"How well do published neurodiversity accounts represent non-speaking people, people with intellectual disability and people with very high support needs?","why_it_matters":"A framework may appear inclusive while evidence and consultation disproportionately reflect people able to participate in conventional research and advocacy.","what_would_reduce_it":["Accessible participatory research using multiple communication modes and deliberate inclusion of people with high support needs and their chosen supporters."],"status":"open"}],"perspectives":[{"id":"neurodiversity-perspective-collective","held_by":"Historical revision scholars and early-community accounts","summary":"Neurodiversity theory should be understood as a collective development rather than the invention of one person.","source_ids":["neurodiversity-source-botha-2024"]},{"id":"neurodiversity-perspective-paradigm","held_by":"Neurodiversity scholars and advocates","summary":"Neurological differences should be studied with greater attention to variation, rights, environment and participation rather than being framed only as individual deficit.","source_ids":["neurodiversity-source-pellicano-2022"]},{"id":"neurodiversity-perspective-integration","held_by":"Writers seeking overlap between neurodiversity and clinical support","summary":"Recognition of neurodivergent identity and social barriers can coexist with acknowledgement of disability, individual impairment and wanted clinical support.","source_ids":["neurodiversity-source-kapp-2026"]}],"relations":[{"type":"related_to","target_id":"autism","note":"Autism has been central to the history and development of neurodiversity discourse; this is an ecosystem relation, not a taxonomic parent-child claim."},{"type":"related_to","target_id":"adhd","note":"ADHD is commonly discussed within neurodiversity communities and scholarship; this is an ecosystem relation, not a taxonomic parent-child claim."}],"ecosystem_entry_points":[{"category":"communities","questions":["Who defines membership and language?","Whose access and support needs are underrepresented?"]},{"category":"organisations","questions":["Is governance meaningfully led by neurodivergent people?","Are funding and conflicts transparent?"]},{"category":"books_media","questions":["Does the work distinguish diversity, disability, diagnosis, identity and political commitments?","Whose perspective is missing?"]}],"provenance":{"created":"2026-08-10","created_by":"Codex from user-authorised seed scope","method":"Candidate-only Batch B re-review of the original five concepts using current historical, peer-reviewed and public evidence; substantive promotion requires the batch review gate.","review_state":"unreviewed_seed","last_reviewed":null}}
