{"schema_version":"0.1","id":"interoception","type":"concept","name":"Interoception","aliases":[],"status":"reviewed","summary":"Interoception concerns sensing, interpreting and relating to signals from inside the body; it includes multiple measurable dimensions, and current autism research does not support a simple claim that all autistic people have globally reduced interoception.","scope":{"includes":["Internal bodily signals such as heartbeat, breathing, hunger, temperature and other physiological states.","Interoceptive accuracy, sensibility and awareness as distinguishable measurement dimensions.","Variation across tasks, ages, neurotypes and contexts."],"excludes":["Equating interoception with one heartbeat task.","Assuming an autism diagnosis implies poor interoception.","Using interoceptive difficulty as a standalone diagnosis."]},"claims":[{"id":"interoception-claim-core","text":"A 2025 systematic review and meta-analysis found inconsistent interoception results across autistic samples and no significant group difference in comparable adult cardiac interoceptive accuracy studies.","confidence":"high","source_ids":["interoception-source-core"],"uncertainty_ids":["interoception-uncertainty-core"]}],"sources":[{"id":"interoception-source-core","kind":"peer_reviewed","citation":"Klein M, Witthoft M, Jungmann SM. Interoception in individuals with autism spectrum disorder: a systematic literature review and meta-analysis. Frontiers in Psychiatry. 2025;16:1573263.","url":"https://pubmed.ncbi.nlm.nih.gov/40909407/","doi":"10.3389/fpsyt.2025.1573263","accessed":"2026-08-28","supports":["interoception-claim-core","interoception-perspective-core"]}],"uncertainties":[{"id":"interoception-uncertainty-core","question":"How do different interoception measures map onto everyday bodily awareness across ages, neurotypes and co-occurring conditions?","why_it_matters":"Laboratory accuracy, self-report and everyday experience may measure different aspects of interoception.","what_would_reduce_it":["Standardised multimethod studies with measurement-invariance testing.","Longitudinal work connecting laboratory measures to functional everyday outcomes."],"status":"open"}],"perspectives":[{"id":"interoception-perspective-core","held_by":"Systematic-review evidence","summary":"Interoception should be treated as multidimensional and heterogeneous; contradictory findings are evidence against a one-size-fits-all deficit story.","source_ids":["interoception-source-core"]}],"relations":[{"type":"related_to","target_id":"sensory-processing","note":"Interoceptive signals are often included within broad sensory-processing frameworks."},{"type":"related_to","target_id":"alexithymia","note":"Bodily-state awareness and emotion identification can interact, but interoception and alexithymia are not the same construct."}],"ecosystem_entry_points":[{"category":"practical_resources","questions":["What bodily signal or functional problem is the strategy intended to address?"]},{"category":"services","questions":["Is measurement tied to a real-world question rather than a generic deficit score?"]}],"provenance":{"created":"2026-08-28","created_by":"ND Oracle project-controlled curation","method":"Evidence-bounded content expansion for v0.9. Primary research or authoritative source checked on 2026-08-28; claims are deliberately narrower than the source and uncertainty remains explicit.","review_state":"editor_reviewed","last_reviewed":"2026-08-28"}}
