{"schema_version":"0.1","id":"masking","type":"concept","name":"Masking and camouflaging","aliases":[],"status":"reviewed","summary":"Masking or camouflaging describes strategies and behaviours some autistic people use to reduce the visibility of autistic differences or navigate social expectations; measurement varies and the experience is not universal.","scope":{"includes":["Conscious and less-conscious strategies used to manage how autistic differences are perceived.","Self-reported effort, behavioural presentation and the mismatch between internal experience and outward appearance.","Possible costs, benefits and context dependence."],"excludes":["Assuming every autistic person masks.","Treating masking as evidence that someone is or is not autistic.","Treating masking as exclusive to women or girls."]},"claims":[{"id":"masking-claim-core","text":"Autistic camouflaging is measured in multiple ways and varies substantially between people; systematic-review evidence does not support treating it as a universal autistic experience.","confidence":"high","source_ids":["masking-source-core"],"uncertainty_ids":["masking-uncertainty-core"]}],"sources":[{"id":"masking-source-core","kind":"peer_reviewed","citation":"Cook J, Hull L, Crane L, Mandy W. Camouflaging in autism: A systematic review. Clinical Psychology Review. 2021;89:102080.","url":"https://pubmed.ncbi.nlm.nih.gov/34563942/","doi":"10.1016/j.cpr.2021.102080","accessed":"2026-08-28","supports":["masking-claim-core","masking-perspective-core"]}],"uncertainties":[{"id":"masking-uncertainty-core","question":"How should camouflaging be measured without confusing outward presentation, self-reported effort and social adaptation?","why_it_matters":"Different measures may capture different phenomena and can produce different conclusions about who masks and at what cost.","what_would_reduce_it":["Longitudinal and multimethod research with diverse autistic participants.","Measures co-designed with autistic people and validated across gender, age and communication style."],"status":"open"}],"perspectives":[{"id":"masking-perspective-core","held_by":"Systematic-review framing","summary":"Camouflaging is better treated as a variable set of strategies and experiences than as a single trait or a gender-specific diagnostic shortcut.","source_ids":["masking-source-core"]}],"relations":[{"type":"related_to","target_id":"autism","note":"Camouflaging research has largely focused on autistic people and autistic traits."},{"type":"related_to","target_id":"autistic-burnout","note":"Sustained effort to meet environmental and social demands is discussed in burnout accounts, but masking is not by itself a demonstrated cause of every burnout episode."},{"type":"related_to","target_id":"communication-differences","note":"Masking can involve adapting communication style to social expectations."}],"ecosystem_entry_points":[{"category":"books_media","questions":["Whose perspective is being described, and is it presented as universal?"]},{"category":"accommodations","questions":["Can the environment reduce pressure to perform a particular social style?"]}],"provenance":{"created":"2026-08-28","created_by":"ND Oracle project-controlled curation","method":"Evidence-bounded content expansion for v0.9. Primary research or authoritative source checked on 2026-08-28; claims are deliberately narrower than the source and uncertainty remains explicit.","review_state":"editor_reviewed","last_reviewed":"2026-08-28"}}
