{
  "schema_version": "0.1", "id": "autism", "type": "concept", "name": "Autism", "aliases": ["autism spectrum disorder", "autism spectrum condition"], "status": "seed",
  "summary": "Autism is a lifelong and heterogeneous neurodevelopmental condition or identity associated with differences in social communication, patterns of behaviour or interests, and sensory experience, with widely varying strengths and support needs.",
  "scope": {"includes": ["clinical descriptions", "autistic identity and community perspectives", "support, access, and environmental fit across the lifespan"], "excludes": ["individual diagnosis", "a single presentation or support profile", "claims that one language preference fits every autistic person"]},
  "claims": [
    {"id": "autism-claim-1", "text": "Autistic people's abilities and support needs vary substantially and may change across contexts and over time.", "confidence": "high", "source_ids": ["autism-source-who"], "uncertainty_ids": ["autism-uncertainty-measurement"]},
    {"id": "autism-claim-2", "text": "Sensory hyperreactivity, hyporeactivity, or unusual sensory interests can be part of autistic experience, but sensory profiles are heterogeneous.", "confidence": "moderate", "source_ids": ["autism-source-who", "autism-source-neurobiology"], "uncertainty_ids": ["autism-uncertainty-sensory"]}
  ],
  "sources": [
    {"id": "autism-source-who", "kind": "authoritative_guidance", "citation": "World Health Organization. Autism fact sheet (17 September 2025).", "url": "https://www.who.int/news-room/fact-sheets/detail/autism-spectrum-disorders", "accessed": "2026-08-10", "supports": ["autism-claim-1", "autism-claim-2", "autism-perspective-clinical"]},
    {"id": "autism-source-neurobiology", "kind": "peer_reviewed", "citation": "Kawakami, S. et al. Neurobiology of sensory processing in autism spectrum disorder (2020).", "url": "https://pubmed.ncbi.nlm.nih.gov/32711809/", "accessed": "2026-08-10", "supports": ["autism-claim-2"]}
  ],
  "uncertainties": [
    {"id": "autism-uncertainty-measurement", "question": "How can research and services represent changing, context-dependent support needs without collapsing people into functioning labels?", "why_it_matters": "Poor categories can hide support needs, autonomy, or strengths.", "what_would_reduce_it": ["longitudinal community-led studies", "multidimensional support descriptions", "validation across ages, cultures, communication modes, and intellectual abilities"], "status": "open"},
    {"id": "autism-uncertainty-sensory", "question": "Which sensory measures predict useful, person-defined accommodations across settings?", "why_it_matters": "Group findings do not identify what will help a particular person.", "what_would_reduce_it": ["participatory trials of accommodations", "ecologically valid measures", "reporting of benefit, burden, and adverse effects"], "status": "open"}
  ],
  "perspectives": [
    {"id": "autism-perspective-clinical", "held_by": "World Health Organization", "summary": "Autism is a diverse group of conditions related to brain development, with variable abilities and needs requiring accessible and inclusive support.", "source_ids": ["autism-source-who"]}
  ],
  "relations": [
    {"type": "narrower_than", "target_id": "neurodiversity", "note": "Autism is commonly situated within neurodiversity discourse."},
    {"type": "related_to", "target_id": "sensory-processing", "note": "Sensory differences are common but heterogeneous."},
    {"type": "related_to", "target_id": "executive-function", "note": "Executive demands can shape daily access and support; this is not a defining equivalence."}
  ],
  "ecosystem_entry_points": [
    {"category": "accommodations", "questions": ["What barrier is being changed?", "Does the autistic person control and evaluate the accommodation?"]},
    {"category": "services", "questions": ["Are goals person-defined and non-coercive?", "Are communication access and safeguarding explicit?"]},
    {"category": "tools", "questions": ["What outcome and context support the claim?", "Can the tool increase distress, surveillance, or dependency?"]},
    {"category": "communities", "questions": ["Are non-speaking people and people with high support needs represented?", "What communication modes are supported?"]}
  ],
  "provenance": {"created": "2026-08-10", "created_by": "Codex from user-authorised seed scope", "method": "Structured synthesis of cited public sources; no community review yet", "review_state": "unreviewed_seed", "last_reviewed": null}
}
