{"schema_version":"0.1","id":"task-initiation","type":"concept","name":"Task initiation","aliases":[],"status":"reviewed","summary":"Task initiation is the process of moving from intending or needing to act into beginning the action; difficulty starting tasks can occur for many reasons and across neurotypes, and is not a diagnostic synonym for ADHD, autism or procrastination.","scope":{"includes":["Beginning an intended task or action.","Executive, motivational, emotional and contextual contributors to getting started.","Task transitions, external structure and practical supports."],"excludes":["Equating all procrastination with ADHD.","Assuming a person who has not started does not want to act.","Treating one productivity technique as a clinical treatment."]},"claims":[{"id":"task-initiation-claim-core","text":"Research finds initiation and procrastination difficulties can be associated with neurodevelopmental traits, but patterns vary and do not identify a single diagnosis or mechanism.","confidence":"moderate","source_ids":["task-initiation-source-core"],"uncertainty_ids":["task-initiation-uncertainty-core"]}],"sources":[{"id":"task-initiation-source-core","kind":"peer_reviewed","citation":"Suriano R. A systematic review on the association between ADHD and procrastination. Research in Developmental Disabilities. 2026;175:105342.","url":"https://pubmed.ncbi.nlm.nih.gov/42456607/","doi":"10.1016/j.ridd.2026.105342","accessed":"2026-08-28","supports":["task-initiation-claim-core","task-initiation-perspective-core"]}],"uncertainties":[{"id":"task-initiation-uncertainty-core","question":"Which mechanisms most often drive task-starting difficulty for a particular person: attention, uncertainty, task size, reward, emotion, fatigue, sensory conditions or something else?","why_it_matters":"Different mechanisms can look like the same delay but respond differently to support.","what_would_reduce_it":["Prospective and experimental work that distinguishes initiation from broader procrastination.","Person-level studies linking specific barriers to functional support outcomes."],"status":"open"}],"perspectives":[{"id":"task-initiation-perspective-core","held_by":"Systematic-review evidence","summary":"ADHD symptoms, particularly inattention, are associated with procrastination at group level, but mainly cross-sectional evidence cannot establish one causal pathway or make the difficulty ADHD-specific.","source_ids":["task-initiation-source-core"]}],"relations":[{"type":"related_to","target_id":"executive-function","note":"Initiation is commonly discussed within everyday executive functioning."},{"type":"related_to","target_id":"adhd","note":"ADHD symptoms are associated with procrastination and organisation difficulty, without making task initiation specific to ADHD."},{"type":"related_to","target_id":"autism","note":"Some studies report initiation and planning differences in autistic adults, again without diagnostic specificity."},{"type":"related_to","target_id":"monotropism","note":"Attention switching and strongly engaged interests may be relevant to some transitions, but monotropism is not a universal explanation for task-starting difficulty."}],"ecosystem_entry_points":[{"category":"tools","questions":["Does the tool reduce a specific starting barrier such as task ambiguity, time uncertainty or forgetting?"]},{"category":"accommodations","questions":["Can task expectations, sequencing or transitions be made clearer?"]}],"provenance":{"created":"2026-08-28","created_by":"ND Oracle project-controlled curation","method":"Evidence-bounded content expansion for v0.9. Primary research or authoritative source checked on 2026-08-28; claims are deliberately narrower than the source and uncertainty remains explicit.","review_state":"editor_reviewed","last_reviewed":"2026-08-28"}}
